==========================================
SLURM_JOB_ID = 7620922
SLURM_NODELIST = gpu-4-56
==========================================
Unloading openmpi/4.1.5
Unloading slurm/22.05.9.p2
Loading slurm/22.05.9.p2
Loading openmpi/4.1.5
+ python CNN.py /home/zhuosl/VPML/Genome_matrix/genome_matrix.csv
CNN.py:26: UserWarning: To copy construct from a tensor, it is recommended to use sourceTensor.clone().detach() or sourceTensor.clone().detach().requires_grad_(True), rather than torch.tensor(sourceTensor).
  feature = torch.tensor(self.features[index], dtype=torch.float32)
CNN.py:27: UserWarning: To copy construct from a tensor, it is recommended to use sourceTensor.clone().detach() or sourceTensor.clone().detach().requires_grad_(True), rather than torch.tensor(sourceTensor).
  label = torch.tensor(self.labels[index], dtype=torch.int64)
CNN.py:26: UserWarning: To copy construct from a tensor, it is recommended to use sourceTensor.clone().detach() or sourceTensor.clone().detach().requires_grad_(True), rather than torch.tensor(sourceTensor).
  feature = torch.tensor(self.features[index], dtype=torch.float32)
CNN.py:27: UserWarning: To copy construct from a tensor, it is recommended to use sourceTensor.clone().detach() or sourceTensor.clone().detach().requires_grad_(True), rather than torch.tensor(sourceTensor).
  label = torch.tensor(self.labels[index], dtype=torch.int64)
CNN.py:26: UserWarning: To copy construct from a tensor, it is recommended to use sourceTensor.clone().detach() or sourceTensor.clone().detach().requires_grad_(True), rather than torch.tensor(sourceTensor).
  feature = torch.tensor(self.features[index], dtype=torch.float32)
CNN.py:27: UserWarning: To copy construct from a tensor, it is recommended to use sourceTensor.clone().detach() or sourceTensor.clone().detach().requires_grad_(True), rather than torch.tensor(sourceTensor).
  label = torch.tensor(self.labels[index], dtype=torch.int64)
CNN.py:26: UserWarning: To copy construct from a tensor, it is recommended to use sourceTensor.clone().detach() or sourceTensor.clone().detach().requires_grad_(True), rather than torch.tensor(sourceTensor).
  feature = torch.tensor(self.features[index], dtype=torch.float32)
CNN.py:27: UserWarning: To copy construct from a tensor, it is recommended to use sourceTensor.clone().detach() or sourceTensor.clone().detach().requires_grad_(True), rather than torch.tensor(sourceTensor).
  label = torch.tensor(self.labels[index], dtype=torch.int64)
CNN.py:26: UserWarning: To copy construct from a tensor, it is recommended to use sourceTensor.clone().detach() or sourceTensor.clone().detach().requires_grad_(True), rather than torch.tensor(sourceTensor).
  feature = torch.tensor(self.features[index], dtype=torch.float32)
CNN.py:27: UserWarning: To copy construct from a tensor, it is recommended to use sourceTensor.clone().detach() or sourceTensor.clone().detach().requires_grad_(True), rather than torch.tensor(sourceTensor).
  label = torch.tensor(self.labels[index], dtype=torch.int64)
torch.Size([1980, 1, 64, 66])
torch.Size([1980])
Fold 1/5
Epoch [1/100], Training Loss: 0.6917, Training Accuracy: 51.07%, Test Accuracy: 66.16%
Epoch [2/100], Training Loss: 0.6584, Training Accuracy: 60.35%, Test Accuracy: 61.62%
Epoch [3/100], Training Loss: 0.6228, Training Accuracy: 73.04%, Test Accuracy: 68.94%
Epoch [4/100], Training Loss: 0.5705, Training Accuracy: 78.66%, Test Accuracy: 75.00%
Epoch [5/100], Training Loss: 0.5260, Training Accuracy: 82.13%, Test Accuracy: 78.54%
Epoch [6/100], Training Loss: 0.4967, Training Accuracy: 83.21%, Test Accuracy: 81.57%
Epoch [7/100], Training Loss: 0.4682, Training Accuracy: 86.36%, Test Accuracy: 84.60%
Epoch [8/100], Training Loss: 0.4462, Training Accuracy: 88.32%, Test Accuracy: 85.61%
Epoch [9/100], Training Loss: 0.4380, Training Accuracy: 88.45%, Test Accuracy: 86.36%
Epoch [10/100], Training Loss: 0.4176, Training Accuracy: 91.48%, Test Accuracy: 85.35%
Epoch [11/100], Training Loss: 0.4078, Training Accuracy: 91.54%, Test Accuracy: 86.62%
Epoch [12/100], Training Loss: 0.3986, Training Accuracy: 92.42%, Test Accuracy: 87.37%
Epoch [13/100], Training Loss: 0.3910, Training Accuracy: 93.31%, Test Accuracy: 87.88%
Epoch [14/100], Training Loss: 0.3837, Training Accuracy: 94.00%, Test Accuracy: 88.38%
Epoch [15/100], Training Loss: 0.3739, Training Accuracy: 95.01%, Test Accuracy: 88.13%
Epoch [16/100], Training Loss: 0.3706, Training Accuracy: 95.20%, Test Accuracy: 87.88%
Epoch [17/100], Training Loss: 0.3675, Training Accuracy: 95.58%, Test Accuracy: 87.88%
Epoch [18/100], Training Loss: 0.3633, Training Accuracy: 95.77%, Test Accuracy: 88.64%
Epoch [19/100], Training Loss: 0.3591, Training Accuracy: 96.34%, Test Accuracy: 87.37%
Epoch [20/100], Training Loss: 0.3599, Training Accuracy: 95.71%, Test Accuracy: 87.37%
Epoch [21/100], Training Loss: 0.3561, Training Accuracy: 96.28%, Test Accuracy: 87.88%
Epoch [22/100], Training Loss: 0.3522, Training Accuracy: 96.78%, Test Accuracy: 87.37%
Epoch [23/100], Training Loss: 0.3501, Training Accuracy: 96.84%, Test Accuracy: 87.88%
Epoch [24/100], Training Loss: 0.3522, Training Accuracy: 96.28%, Test Accuracy: 87.63%
Epoch [25/100], Training Loss: 0.3473, Training Accuracy: 96.91%, Test Accuracy: 87.37%
Epoch [26/100], Training Loss: 0.3466, Training Accuracy: 97.29%, Test Accuracy: 87.37%
Epoch [27/100], Training Loss: 0.3455, Training Accuracy: 97.10%, Test Accuracy: 87.88%
Epoch [28/100], Training Loss: 0.3448, Training Accuracy: 97.16%, Test Accuracy: 87.88%
Epoch [29/100], Training Loss: 0.3431, Training Accuracy: 97.29%, Test Accuracy: 87.12%
Epoch [30/100], Training Loss: 0.3401, Training Accuracy: 97.66%, Test Accuracy: 87.12%
Epoch [31/100], Training Loss: 0.3406, Training Accuracy: 97.60%, Test Accuracy: 88.13%
Epoch [32/100], Training Loss: 0.3399, Training Accuracy: 97.79%, Test Accuracy: 87.63%
Epoch [33/100], Training Loss: 0.3384, Training Accuracy: 97.85%, Test Accuracy: 88.13%
Epoch [34/100], Training Loss: 0.3384, Training Accuracy: 97.85%, Test Accuracy: 88.38%
Epoch [35/100], Training Loss: 0.3366, Training Accuracy: 97.98%, Test Accuracy: 88.13%
Epoch [36/100], Training Loss: 0.3363, Training Accuracy: 97.98%, Test Accuracy: 87.88%
Epoch [37/100], Training Loss: 0.3358, Training Accuracy: 98.11%, Test Accuracy: 88.38%
Epoch [38/100], Training Loss: 0.3352, Training Accuracy: 97.98%, Test Accuracy: 88.38%
Epoch [39/100], Training Loss: 0.3340, Training Accuracy: 98.17%, Test Accuracy: 88.13%
Epoch [40/100], Training Loss: 0.3334, Training Accuracy: 98.23%, Test Accuracy: 87.37%
Epoch [41/100], Training Loss: 0.3340, Training Accuracy: 98.11%, Test Accuracy: 87.63%
Epoch [42/100], Training Loss: 0.3339, Training Accuracy: 98.23%, Test Accuracy: 87.88%
Epoch [43/100], Training Loss: 0.3340, Training Accuracy: 98.17%, Test Accuracy: 87.88%
Epoch [44/100], Training Loss: 0.3323, Training Accuracy: 98.23%, Test Accuracy: 88.13%
Epoch [45/100], Training Loss: 0.3334, Training Accuracy: 98.23%, Test Accuracy: 87.63%
Epoch [46/100], Training Loss: 0.3323, Training Accuracy: 98.30%, Test Accuracy: 87.63%
Epoch [47/100], Training Loss: 0.3317, Training Accuracy: 98.30%, Test Accuracy: 87.88%
Epoch [48/100], Training Loss: 0.3322, Training Accuracy: 98.30%, Test Accuracy: 87.88%
Epoch [49/100], Training Loss: 0.3313, Training Accuracy: 98.42%, Test Accuracy: 88.13%
Epoch [50/100], Training Loss: 0.3311, Training Accuracy: 98.42%, Test Accuracy: 87.63%
Epoch [51/100], Training Loss: 0.3305, Training Accuracy: 98.42%, Test Accuracy: 88.13%
Epoch [52/100], Training Loss: 0.3301, Training Accuracy: 98.48%, Test Accuracy: 88.13%
Epoch [53/100], Training Loss: 0.3306, Training Accuracy: 98.48%, Test Accuracy: 87.88%
Epoch [54/100], Training Loss: 0.3296, Training Accuracy: 98.48%, Test Accuracy: 87.88%
Epoch [55/100], Training Loss: 0.3297, Training Accuracy: 98.48%, Test Accuracy: 87.88%
Epoch [56/100], Training Loss: 0.3296, Training Accuracy: 98.48%, Test Accuracy: 87.88%
Epoch [57/100], Training Loss: 0.3285, Training Accuracy: 98.55%, Test Accuracy: 88.64%
Epoch [58/100], Training Loss: 0.3291, Training Accuracy: 98.55%, Test Accuracy: 87.88%
Epoch [59/100], Training Loss: 0.3285, Training Accuracy: 98.55%, Test Accuracy: 88.13%
Epoch [60/100], Training Loss: 0.3289, Training Accuracy: 98.55%, Test Accuracy: 88.38%
Epoch [61/100], Training Loss: 0.3282, Training Accuracy: 98.67%, Test Accuracy: 88.13%
Epoch [62/100], Training Loss: 0.3274, Training Accuracy: 98.67%, Test Accuracy: 88.38%
Epoch [63/100], Training Loss: 0.3279, Training Accuracy: 98.61%, Test Accuracy: 88.64%
Epoch [64/100], Training Loss: 0.3273, Training Accuracy: 98.74%, Test Accuracy: 88.64%
Epoch [65/100], Training Loss: 0.3284, Training Accuracy: 98.61%, Test Accuracy: 88.89%
Epoch [66/100], Training Loss: 0.3278, Training Accuracy: 98.61%, Test Accuracy: 88.64%
Epoch [67/100], Training Loss: 0.3271, Training Accuracy: 98.67%, Test Accuracy: 88.38%
Epoch [68/100], Training Loss: 0.3272, Training Accuracy: 98.74%, Test Accuracy: 88.89%
Epoch [69/100], Training Loss: 0.3269, Training Accuracy: 98.67%, Test Accuracy: 88.38%
Epoch [70/100], Training Loss: 0.3281, Training Accuracy: 98.55%, Test Accuracy: 88.13%
Epoch [71/100], Training Loss: 0.3270, Training Accuracy: 98.74%, Test Accuracy: 88.89%
Epoch [72/100], Training Loss: 0.3273, Training Accuracy: 98.67%, Test Accuracy: 88.38%
Epoch [73/100], Training Loss: 0.3272, Training Accuracy: 98.80%, Test Accuracy: 88.13%
Epoch [74/100], Training Loss: 0.3262, Training Accuracy: 98.80%, Test Accuracy: 88.13%
Epoch [75/100], Training Loss: 0.3270, Training Accuracy: 98.74%, Test Accuracy: 88.38%
Epoch [76/100], Training Loss: 0.3256, Training Accuracy: 98.86%, Test Accuracy: 88.38%
Epoch [77/100], Training Loss: 0.3276, Training Accuracy: 98.74%, Test Accuracy: 88.13%
Epoch [78/100], Training Loss: 0.3262, Training Accuracy: 98.80%, Test Accuracy: 88.64%
Epoch [79/100], Training Loss: 0.3261, Training Accuracy: 98.80%, Test Accuracy: 88.38%
Epoch [80/100], Training Loss: 0.3259, Training Accuracy: 98.80%, Test Accuracy: 88.13%
Epoch [81/100], Training Loss: 0.3257, Training Accuracy: 98.80%, Test Accuracy: 88.64%
Epoch [82/100], Training Loss: 0.3259, Training Accuracy: 98.80%, Test Accuracy: 87.88%
Epoch [83/100], Training Loss: 0.3261, Training Accuracy: 98.80%, Test Accuracy: 88.38%
Epoch [84/100], Training Loss: 0.3255, Training Accuracy: 98.86%, Test Accuracy: 88.64%
Epoch [85/100], Training Loss: 0.3260, Training Accuracy: 98.80%, Test Accuracy: 88.64%
Epoch [86/100], Training Loss: 0.3260, Training Accuracy: 98.86%, Test Accuracy: 88.38%
Epoch [87/100], Training Loss: 0.3255, Training Accuracy: 98.86%, Test Accuracy: 88.38%
Epoch [88/100], Training Loss: 0.3253, Training Accuracy: 98.86%, Test Accuracy: 88.38%
Epoch [89/100], Training Loss: 0.3253, Training Accuracy: 98.86%, Test Accuracy: 88.13%
Epoch [90/100], Training Loss: 0.3252, Training Accuracy: 98.86%, Test Accuracy: 88.13%
Epoch [91/100], Training Loss: 0.3258, Training Accuracy: 98.86%, Test Accuracy: 88.38%
Epoch [92/100], Training Loss: 0.3254, Training Accuracy: 98.86%, Test Accuracy: 88.38%
Epoch [93/100], Training Loss: 0.3250, Training Accuracy: 98.86%, Test Accuracy: 88.13%
Epoch [94/100], Training Loss: 0.3250, Training Accuracy: 98.86%, Test Accuracy: 88.38%
Epoch [95/100], Training Loss: 0.3256, Training Accuracy: 98.80%, Test Accuracy: 88.89%
Epoch [96/100], Training Loss: 0.3256, Training Accuracy: 98.86%, Test Accuracy: 88.38%
Epoch [97/100], Training Loss: 0.3254, Training Accuracy: 98.86%, Test Accuracy: 89.14%
Epoch [98/100], Training Loss: 0.3252, Training Accuracy: 98.86%, Test Accuracy: 88.64%
Epoch [99/100], Training Loss: 0.3250, Training Accuracy: 98.86%, Test Accuracy: 89.14%
Epoch [100/100], Training Loss: 0.3251, Training Accuracy: 98.86%, Test Accuracy: 89.14%
Finished Training
Final Evaluation: Precision: 0.8927, Recall: 0.8914, F1 Score: 0.8914, Accuracy: 0.8914
Fold 2/5
Epoch [1/100], Training Loss: 0.6851, Training Accuracy: 55.87%, Test Accuracy: 54.80%
Epoch [2/100], Training Loss: 0.6503, Training Accuracy: 63.89%, Test Accuracy: 72.98%
Epoch [3/100], Training Loss: 0.6062, Training Accuracy: 76.07%, Test Accuracy: 74.75%
Epoch [4/100], Training Loss: 0.5562, Training Accuracy: 79.10%, Test Accuracy: 80.30%
Epoch [5/100], Training Loss: 0.5171, Training Accuracy: 81.94%, Test Accuracy: 84.09%
Epoch [6/100], Training Loss: 0.4878, Training Accuracy: 84.66%, Test Accuracy: 85.61%
Epoch [7/100], Training Loss: 0.4628, Training Accuracy: 87.69%, Test Accuracy: 85.86%
Epoch [8/100], Training Loss: 0.4462, Training Accuracy: 88.07%, Test Accuracy: 86.62%
Epoch [9/100], Training Loss: 0.4263, Training Accuracy: 90.21%, Test Accuracy: 86.87%
Epoch [10/100], Training Loss: 0.4167, Training Accuracy: 90.78%, Test Accuracy: 87.88%
Epoch [11/100], Training Loss: 0.4059, Training Accuracy: 91.60%, Test Accuracy: 89.39%
Epoch [12/100], Training Loss: 0.3959, Training Accuracy: 92.99%, Test Accuracy: 90.40%
Epoch [13/100], Training Loss: 0.3860, Training Accuracy: 94.00%, Test Accuracy: 89.90%
Epoch [14/100], Training Loss: 0.3825, Training Accuracy: 94.32%, Test Accuracy: 89.14%
Epoch [15/100], Training Loss: 0.3746, Training Accuracy: 95.01%, Test Accuracy: 89.90%
Epoch [16/100], Training Loss: 0.3707, Training Accuracy: 95.08%, Test Accuracy: 90.91%
Epoch [17/100], Training Loss: 0.3666, Training Accuracy: 95.39%, Test Accuracy: 91.16%
Epoch [18/100], Training Loss: 0.3629, Training Accuracy: 95.39%, Test Accuracy: 90.66%
Epoch [19/100], Training Loss: 0.3633, Training Accuracy: 96.15%, Test Accuracy: 91.41%
Epoch [20/100], Training Loss: 0.3593, Training Accuracy: 96.15%, Test Accuracy: 90.15%
Epoch [21/100], Training Loss: 0.3542, Training Accuracy: 96.53%, Test Accuracy: 91.41%
Epoch [22/100], Training Loss: 0.3541, Training Accuracy: 96.59%, Test Accuracy: 91.67%
Epoch [23/100], Training Loss: 0.3487, Training Accuracy: 96.78%, Test Accuracy: 91.41%
Epoch [24/100], Training Loss: 0.3517, Training Accuracy: 96.72%, Test Accuracy: 90.66%
Epoch [25/100], Training Loss: 0.3490, Training Accuracy: 96.91%, Test Accuracy: 91.16%
Epoch [26/100], Training Loss: 0.3469, Training Accuracy: 96.97%, Test Accuracy: 90.66%
Epoch [27/100], Training Loss: 0.3456, Training Accuracy: 97.03%, Test Accuracy: 91.41%
Epoch [28/100], Training Loss: 0.3454, Training Accuracy: 97.22%, Test Accuracy: 90.91%
Epoch [29/100], Training Loss: 0.3452, Training Accuracy: 97.10%, Test Accuracy: 90.66%
Epoch [30/100], Training Loss: 0.3452, Training Accuracy: 97.03%, Test Accuracy: 91.67%
Epoch [31/100], Training Loss: 0.3439, Training Accuracy: 97.03%, Test Accuracy: 91.16%
Epoch [32/100], Training Loss: 0.3417, Training Accuracy: 97.35%, Test Accuracy: 91.16%
Epoch [33/100], Training Loss: 0.3406, Training Accuracy: 97.60%, Test Accuracy: 90.91%
Epoch [34/100], Training Loss: 0.3442, Training Accuracy: 97.10%, Test Accuracy: 90.40%
Epoch [35/100], Training Loss: 0.3412, Training Accuracy: 97.35%, Test Accuracy: 90.91%
Epoch [36/100], Training Loss: 0.3425, Training Accuracy: 97.29%, Test Accuracy: 91.41%
Epoch [37/100], Training Loss: 0.3399, Training Accuracy: 97.54%, Test Accuracy: 91.67%
Epoch [38/100], Training Loss: 0.3395, Training Accuracy: 97.60%, Test Accuracy: 91.67%
Epoch [39/100], Training Loss: 0.3408, Training Accuracy: 97.35%, Test Accuracy: 91.67%
Epoch [40/100], Training Loss: 0.3374, Training Accuracy: 97.73%, Test Accuracy: 91.92%
Epoch [41/100], Training Loss: 0.3390, Training Accuracy: 97.47%, Test Accuracy: 91.92%
Epoch [42/100], Training Loss: 0.3396, Training Accuracy: 97.54%, Test Accuracy: 92.42%
Epoch [43/100], Training Loss: 0.3362, Training Accuracy: 97.60%, Test Accuracy: 92.42%
Epoch [44/100], Training Loss: 0.3368, Training Accuracy: 97.66%, Test Accuracy: 91.92%
Epoch [45/100], Training Loss: 0.3369, Training Accuracy: 97.79%, Test Accuracy: 92.17%
Epoch [46/100], Training Loss: 0.3376, Training Accuracy: 97.79%, Test Accuracy: 92.17%
Epoch [47/100], Training Loss: 0.3371, Training Accuracy: 97.79%, Test Accuracy: 91.92%
Epoch [48/100], Training Loss: 0.3372, Training Accuracy: 97.73%, Test Accuracy: 91.16%
Epoch [49/100], Training Loss: 0.3367, Training Accuracy: 97.79%, Test Accuracy: 91.67%
Epoch [50/100], Training Loss: 0.3367, Training Accuracy: 97.73%, Test Accuracy: 91.92%
Epoch [51/100], Training Loss: 0.3365, Training Accuracy: 97.54%, Test Accuracy: 91.67%
Epoch [52/100], Training Loss: 0.3364, Training Accuracy: 97.79%, Test Accuracy: 91.92%
Epoch [53/100], Training Loss: 0.3355, Training Accuracy: 97.85%, Test Accuracy: 91.16%
Epoch [54/100], Training Loss: 0.3357, Training Accuracy: 97.79%, Test Accuracy: 91.92%
Epoch [55/100], Training Loss: 0.3346, Training Accuracy: 97.85%, Test Accuracy: 91.92%
Epoch [56/100], Training Loss: 0.3355, Training Accuracy: 97.73%, Test Accuracy: 91.92%
Epoch [57/100], Training Loss: 0.3344, Training Accuracy: 98.04%, Test Accuracy: 91.92%
Epoch [58/100], Training Loss: 0.3353, Training Accuracy: 97.79%, Test Accuracy: 91.92%
Epoch [59/100], Training Loss: 0.3348, Training Accuracy: 97.73%, Test Accuracy: 91.16%
Epoch [60/100], Training Loss: 0.3347, Training Accuracy: 97.73%, Test Accuracy: 92.17%
Epoch [61/100], Training Loss: 0.3358, Training Accuracy: 97.98%, Test Accuracy: 92.42%
Epoch [62/100], Training Loss: 0.3336, Training Accuracy: 97.92%, Test Accuracy: 92.42%
Epoch [63/100], Training Loss: 0.3339, Training Accuracy: 97.85%, Test Accuracy: 92.42%
Epoch [64/100], Training Loss: 0.3341, Training Accuracy: 97.85%, Test Accuracy: 91.92%
Epoch [65/100], Training Loss: 0.3332, Training Accuracy: 97.98%, Test Accuracy: 91.92%
Epoch [66/100], Training Loss: 0.3330, Training Accuracy: 97.98%, Test Accuracy: 92.42%
Epoch [67/100], Training Loss: 0.3345, Training Accuracy: 98.04%, Test Accuracy: 92.42%
Epoch [68/100], Training Loss: 0.3332, Training Accuracy: 98.11%, Test Accuracy: 92.42%
Epoch [69/100], Training Loss: 0.3316, Training Accuracy: 98.11%, Test Accuracy: 92.42%
Epoch [70/100], Training Loss: 0.3322, Training Accuracy: 98.04%, Test Accuracy: 92.42%
Epoch [71/100], Training Loss: 0.3335, Training Accuracy: 97.92%, Test Accuracy: 92.42%
Epoch [72/100], Training Loss: 0.3311, Training Accuracy: 98.11%, Test Accuracy: 92.42%
Epoch [73/100], Training Loss: 0.3334, Training Accuracy: 97.98%, Test Accuracy: 92.42%
Epoch [74/100], Training Loss: 0.3322, Training Accuracy: 97.98%, Test Accuracy: 92.42%
Epoch [75/100], Training Loss: 0.3342, Training Accuracy: 97.92%, Test Accuracy: 92.42%
Epoch [76/100], Training Loss: 0.3331, Training Accuracy: 97.98%, Test Accuracy: 92.42%
Epoch [77/100], Training Loss: 0.3326, Training Accuracy: 98.04%, Test Accuracy: 92.42%
Epoch [78/100], Training Loss: 0.3318, Training Accuracy: 98.17%, Test Accuracy: 92.42%
Epoch [79/100], Training Loss: 0.3309, Training Accuracy: 98.17%, Test Accuracy: 91.67%
Epoch [80/100], Training Loss: 0.3328, Training Accuracy: 97.98%, Test Accuracy: 92.42%
Epoch [81/100], Training Loss: 0.3331, Training Accuracy: 97.92%, Test Accuracy: 92.68%
Epoch [82/100], Training Loss: 0.3315, Training Accuracy: 98.04%, Test Accuracy: 90.66%
Epoch [83/100], Training Loss: 0.3314, Training Accuracy: 98.30%, Test Accuracy: 92.42%
Epoch [84/100], Training Loss: 0.3313, Training Accuracy: 98.23%, Test Accuracy: 92.17%
Epoch [85/100], Training Loss: 0.3326, Training Accuracy: 97.92%, Test Accuracy: 92.68%
Epoch [86/100], Training Loss: 0.3312, Training Accuracy: 98.11%, Test Accuracy: 92.17%
Epoch [87/100], Training Loss: 0.3316, Training Accuracy: 98.17%, Test Accuracy: 92.42%
Epoch [88/100], Training Loss: 0.3309, Training Accuracy: 98.17%, Test Accuracy: 92.68%
Epoch [89/100], Training Loss: 0.3306, Training Accuracy: 98.36%, Test Accuracy: 92.68%
Epoch [90/100], Training Loss: 0.3314, Training Accuracy: 98.04%, Test Accuracy: 92.42%
Epoch [91/100], Training Loss: 0.3307, Training Accuracy: 98.17%, Test Accuracy: 92.68%
Epoch [92/100], Training Loss: 0.3319, Training Accuracy: 98.04%, Test Accuracy: 92.68%
Epoch [93/100], Training Loss: 0.3327, Training Accuracy: 97.98%, Test Accuracy: 92.42%
Epoch [94/100], Training Loss: 0.3317, Training Accuracy: 98.23%, Test Accuracy: 92.68%
Epoch [95/100], Training Loss: 0.3305, Training Accuracy: 98.17%, Test Accuracy: 92.68%
Epoch [96/100], Training Loss: 0.3312, Training Accuracy: 98.17%, Test Accuracy: 92.17%
Epoch [97/100], Training Loss: 0.3304, Training Accuracy: 98.17%, Test Accuracy: 92.17%
Epoch [98/100], Training Loss: 0.3318, Training Accuracy: 97.98%, Test Accuracy: 92.17%
Epoch [99/100], Training Loss: 0.3301, Training Accuracy: 98.30%, Test Accuracy: 92.17%
Epoch [100/100], Training Loss: 0.3314, Training Accuracy: 98.11%, Test Accuracy: 92.68%
Finished Training
Final Evaluation: Precision: 0.9271, Recall: 0.9268, F1 Score: 0.9266, Accuracy: 0.9268
Fold 3/5
Epoch [1/100], Training Loss: 0.6832, Training Accuracy: 56.31%, Test Accuracy: 57.32%
Epoch [2/100], Training Loss: 0.6535, Training Accuracy: 61.30%, Test Accuracy: 73.74%
Epoch [3/100], Training Loss: 0.6105, Training Accuracy: 74.62%, Test Accuracy: 81.31%
Epoch [4/100], Training Loss: 0.5625, Training Accuracy: 79.23%, Test Accuracy: 81.82%
Epoch [5/100], Training Loss: 0.5204, Training Accuracy: 83.40%, Test Accuracy: 83.08%
Epoch [6/100], Training Loss: 0.4856, Training Accuracy: 85.61%, Test Accuracy: 83.08%
Epoch [7/100], Training Loss: 0.4609, Training Accuracy: 86.74%, Test Accuracy: 84.60%
Epoch [8/100], Training Loss: 0.4428, Training Accuracy: 88.70%, Test Accuracy: 85.61%
Epoch [9/100], Training Loss: 0.4277, Training Accuracy: 89.33%, Test Accuracy: 86.62%
Epoch [10/100], Training Loss: 0.4149, Training Accuracy: 90.91%, Test Accuracy: 87.88%
Epoch [11/100], Training Loss: 0.4039, Training Accuracy: 92.11%, Test Accuracy: 84.85%
Epoch [12/100], Training Loss: 0.3980, Training Accuracy: 92.68%, Test Accuracy: 89.39%
Epoch [13/100], Training Loss: 0.3892, Training Accuracy: 93.37%, Test Accuracy: 88.38%
Epoch [14/100], Training Loss: 0.3808, Training Accuracy: 94.38%, Test Accuracy: 88.38%
Epoch [15/100], Training Loss: 0.3721, Training Accuracy: 95.08%, Test Accuracy: 88.38%
Epoch [16/100], Training Loss: 0.3687, Training Accuracy: 95.39%, Test Accuracy: 88.38%
Epoch [17/100], Training Loss: 0.3653, Training Accuracy: 95.77%, Test Accuracy: 88.13%
Epoch [18/100], Training Loss: 0.3624, Training Accuracy: 95.77%, Test Accuracy: 89.65%
Epoch [19/100], Training Loss: 0.3589, Training Accuracy: 96.02%, Test Accuracy: 88.13%
Epoch [20/100], Training Loss: 0.3562, Training Accuracy: 96.28%, Test Accuracy: 89.14%
Epoch [21/100], Training Loss: 0.3556, Training Accuracy: 96.40%, Test Accuracy: 89.39%
Epoch [22/100], Training Loss: 0.3530, Training Accuracy: 96.65%, Test Accuracy: 88.89%
Epoch [23/100], Training Loss: 0.3505, Training Accuracy: 96.78%, Test Accuracy: 88.38%
Epoch [24/100], Training Loss: 0.3481, Training Accuracy: 97.03%, Test Accuracy: 89.39%
Epoch [25/100], Training Loss: 0.3459, Training Accuracy: 97.16%, Test Accuracy: 88.64%
Epoch [26/100], Training Loss: 0.3467, Training Accuracy: 97.29%, Test Accuracy: 90.15%
Epoch [27/100], Training Loss: 0.3435, Training Accuracy: 97.41%, Test Accuracy: 88.64%
Epoch [28/100], Training Loss: 0.3432, Training Accuracy: 97.29%, Test Accuracy: 89.39%
Epoch [29/100], Training Loss: 0.3418, Training Accuracy: 97.35%, Test Accuracy: 89.14%
Epoch [30/100], Training Loss: 0.3433, Training Accuracy: 97.29%, Test Accuracy: 88.89%
Epoch [31/100], Training Loss: 0.3423, Training Accuracy: 97.60%, Test Accuracy: 88.89%
Epoch [32/100], Training Loss: 0.3403, Training Accuracy: 97.66%, Test Accuracy: 88.89%
Epoch [33/100], Training Loss: 0.3384, Training Accuracy: 97.66%, Test Accuracy: 89.65%
Epoch [34/100], Training Loss: 0.3377, Training Accuracy: 97.85%, Test Accuracy: 89.14%
Epoch [35/100], Training Loss: 0.3373, Training Accuracy: 97.85%, Test Accuracy: 89.65%
Epoch [36/100], Training Loss: 0.3369, Training Accuracy: 97.98%, Test Accuracy: 89.39%
Epoch [37/100], Training Loss: 0.3362, Training Accuracy: 97.92%, Test Accuracy: 89.39%
Epoch [38/100], Training Loss: 0.3360, Training Accuracy: 97.92%, Test Accuracy: 89.65%
Epoch [39/100], Training Loss: 0.3354, Training Accuracy: 98.04%, Test Accuracy: 89.14%
Epoch [40/100], Training Loss: 0.3359, Training Accuracy: 97.92%, Test Accuracy: 89.14%
Epoch [41/100], Training Loss: 0.3351, Training Accuracy: 97.98%, Test Accuracy: 89.90%
Epoch [42/100], Training Loss: 0.3357, Training Accuracy: 97.98%, Test Accuracy: 89.39%
Epoch [43/100], Training Loss: 0.3338, Training Accuracy: 98.17%, Test Accuracy: 89.65%
Epoch [44/100], Training Loss: 0.3349, Training Accuracy: 98.11%, Test Accuracy: 89.65%
Epoch [45/100], Training Loss: 0.3331, Training Accuracy: 98.23%, Test Accuracy: 89.65%
Epoch [46/100], Training Loss: 0.3334, Training Accuracy: 98.17%, Test Accuracy: 90.40%
Epoch [47/100], Training Loss: 0.3323, Training Accuracy: 98.30%, Test Accuracy: 90.91%
Epoch [48/100], Training Loss: 0.3332, Training Accuracy: 98.23%, Test Accuracy: 89.65%
Epoch [49/100], Training Loss: 0.3320, Training Accuracy: 98.30%, Test Accuracy: 89.65%
Epoch [50/100], Training Loss: 0.3314, Training Accuracy: 98.30%, Test Accuracy: 89.65%
Epoch [51/100], Training Loss: 0.3327, Training Accuracy: 98.04%, Test Accuracy: 89.65%
Epoch [52/100], Training Loss: 0.3310, Training Accuracy: 98.30%, Test Accuracy: 89.65%
Epoch [53/100], Training Loss: 0.3308, Training Accuracy: 98.42%, Test Accuracy: 90.91%
Epoch [54/100], Training Loss: 0.3315, Training Accuracy: 98.17%, Test Accuracy: 91.16%
Epoch [55/100], Training Loss: 0.3323, Training Accuracy: 98.11%, Test Accuracy: 89.90%
Epoch [56/100], Training Loss: 0.3324, Training Accuracy: 98.17%, Test Accuracy: 89.39%
Epoch [57/100], Training Loss: 0.3316, Training Accuracy: 98.23%, Test Accuracy: 89.65%
Epoch [58/100], Training Loss: 0.3313, Training Accuracy: 98.23%, Test Accuracy: 89.65%
Epoch [59/100], Training Loss: 0.3320, Training Accuracy: 98.23%, Test Accuracy: 89.65%
Epoch [60/100], Training Loss: 0.3321, Training Accuracy: 98.30%, Test Accuracy: 89.90%
Epoch [61/100], Training Loss: 0.3306, Training Accuracy: 98.36%, Test Accuracy: 89.90%
Epoch [62/100], Training Loss: 0.3308, Training Accuracy: 98.36%, Test Accuracy: 89.65%
Epoch [63/100], Training Loss: 0.3306, Training Accuracy: 98.36%, Test Accuracy: 89.65%
Epoch [64/100], Training Loss: 0.3315, Training Accuracy: 98.23%, Test Accuracy: 89.90%
Epoch [65/100], Training Loss: 0.3308, Training Accuracy: 98.36%, Test Accuracy: 89.65%
Epoch [66/100], Training Loss: 0.3305, Training Accuracy: 98.36%, Test Accuracy: 89.90%
Epoch [67/100], Training Loss: 0.3306, Training Accuracy: 98.36%, Test Accuracy: 89.90%
Epoch [68/100], Training Loss: 0.3306, Training Accuracy: 98.36%, Test Accuracy: 89.90%
Epoch [69/100], Training Loss: 0.3305, Training Accuracy: 98.36%, Test Accuracy: 89.90%
Epoch [70/100], Training Loss: 0.3305, Training Accuracy: 98.36%, Test Accuracy: 89.90%
Epoch [71/100], Training Loss: 0.3301, Training Accuracy: 98.36%, Test Accuracy: 89.90%
Epoch [72/100], Training Loss: 0.3310, Training Accuracy: 98.36%, Test Accuracy: 89.65%
Epoch [73/100], Training Loss: 0.3311, Training Accuracy: 98.30%, Test Accuracy: 89.90%
Epoch [74/100], Training Loss: 0.3306, Training Accuracy: 98.36%, Test Accuracy: 90.66%
Epoch [75/100], Training Loss: 0.3305, Training Accuracy: 98.36%, Test Accuracy: 90.40%
Epoch [76/100], Training Loss: 0.3304, Training Accuracy: 98.36%, Test Accuracy: 89.90%
Epoch [77/100], Training Loss: 0.3305, Training Accuracy: 98.36%, Test Accuracy: 89.90%
Epoch [78/100], Training Loss: 0.3311, Training Accuracy: 98.36%, Test Accuracy: 89.90%
Epoch [79/100], Training Loss: 0.3302, Training Accuracy: 98.36%, Test Accuracy: 89.90%
Epoch [80/100], Training Loss: 0.3299, Training Accuracy: 98.36%, Test Accuracy: 89.65%
Epoch [81/100], Training Loss: 0.3301, Training Accuracy: 98.36%, Test Accuracy: 89.65%
Epoch [82/100], Training Loss: 0.3303, Training Accuracy: 98.36%, Test Accuracy: 89.65%
Epoch [83/100], Training Loss: 0.3300, Training Accuracy: 98.30%, Test Accuracy: 89.90%
Epoch [84/100], Training Loss: 0.3306, Training Accuracy: 98.23%, Test Accuracy: 89.90%
Epoch [85/100], Training Loss: 0.3304, Training Accuracy: 98.36%, Test Accuracy: 89.90%
Epoch [86/100], Training Loss: 0.3305, Training Accuracy: 98.36%, Test Accuracy: 89.65%
Epoch [87/100], Training Loss: 0.3307, Training Accuracy: 98.36%, Test Accuracy: 89.90%
Epoch [88/100], Training Loss: 0.3302, Training Accuracy: 98.36%, Test Accuracy: 89.90%
Epoch [89/100], Training Loss: 0.3300, Training Accuracy: 98.36%, Test Accuracy: 89.65%
Epoch [90/100], Training Loss: 0.3304, Training Accuracy: 98.36%, Test Accuracy: 89.90%
Epoch [91/100], Training Loss: 0.3303, Training Accuracy: 98.36%, Test Accuracy: 89.90%
Epoch [92/100], Training Loss: 0.3301, Training Accuracy: 98.36%, Test Accuracy: 89.65%
Epoch [93/100], Training Loss: 0.3305, Training Accuracy: 98.36%, Test Accuracy: 89.90%
Epoch [94/100], Training Loss: 0.3300, Training Accuracy: 98.36%, Test Accuracy: 90.15%
Epoch [95/100], Training Loss: 0.3301, Training Accuracy: 98.36%, Test Accuracy: 89.90%
Epoch [96/100], Training Loss: 0.3300, Training Accuracy: 98.36%, Test Accuracy: 89.65%
Epoch [97/100], Training Loss: 0.3299, Training Accuracy: 98.36%, Test Accuracy: 89.65%
Epoch [98/100], Training Loss: 0.3301, Training Accuracy: 98.36%, Test Accuracy: 89.90%
Epoch [99/100], Training Loss: 0.3299, Training Accuracy: 98.36%, Test Accuracy: 90.15%
Epoch [100/100], Training Loss: 0.3300, Training Accuracy: 98.36%, Test Accuracy: 89.90%
Finished Training
Final Evaluation: Precision: 0.9008, Recall: 0.8990, F1 Score: 0.8993, Accuracy: 0.8990
Fold 4/5
Epoch [1/100], Training Loss: 0.6854, Training Accuracy: 55.93%, Test Accuracy: 59.09%
Epoch [2/100], Training Loss: 0.6551, Training Accuracy: 62.18%, Test Accuracy: 79.04%
Epoch [3/100], Training Loss: 0.6076, Training Accuracy: 76.64%, Test Accuracy: 81.82%
Epoch [4/100], Training Loss: 0.5545, Training Accuracy: 79.99%, Test Accuracy: 82.58%
Epoch [5/100], Training Loss: 0.5106, Training Accuracy: 83.78%, Test Accuracy: 84.34%
Epoch [6/100], Training Loss: 0.4780, Training Accuracy: 85.86%, Test Accuracy: 85.86%
Epoch [7/100], Training Loss: 0.4594, Training Accuracy: 87.44%, Test Accuracy: 86.87%
Epoch [8/100], Training Loss: 0.4447, Training Accuracy: 87.82%, Test Accuracy: 87.88%
Epoch [9/100], Training Loss: 0.4300, Training Accuracy: 89.84%, Test Accuracy: 87.88%
Epoch [10/100], Training Loss: 0.4118, Training Accuracy: 91.48%, Test Accuracy: 89.14%
Epoch [11/100], Training Loss: 0.4118, Training Accuracy: 91.54%, Test Accuracy: 89.39%
Epoch [12/100], Training Loss: 0.3957, Training Accuracy: 93.12%, Test Accuracy: 90.40%
Epoch [13/100], Training Loss: 0.3908, Training Accuracy: 93.37%, Test Accuracy: 90.15%
Epoch [14/100], Training Loss: 0.3835, Training Accuracy: 93.94%, Test Accuracy: 89.65%
Epoch [15/100], Training Loss: 0.3751, Training Accuracy: 94.51%, Test Accuracy: 90.40%
Epoch [16/100], Training Loss: 0.3725, Training Accuracy: 95.20%, Test Accuracy: 89.90%
Epoch [17/100], Training Loss: 0.3713, Training Accuracy: 95.14%, Test Accuracy: 91.16%
Epoch [18/100], Training Loss: 0.3645, Training Accuracy: 95.45%, Test Accuracy: 90.15%
Epoch [19/100], Training Loss: 0.3606, Training Accuracy: 95.90%, Test Accuracy: 90.66%
Epoch [20/100], Training Loss: 0.3586, Training Accuracy: 96.28%, Test Accuracy: 89.39%
Epoch [21/100], Training Loss: 0.3552, Training Accuracy: 96.53%, Test Accuracy: 90.40%
Epoch [22/100], Training Loss: 0.3554, Training Accuracy: 96.53%, Test Accuracy: 89.39%
Epoch [23/100], Training Loss: 0.3498, Training Accuracy: 97.03%, Test Accuracy: 89.14%
Epoch [24/100], Training Loss: 0.3492, Training Accuracy: 96.91%, Test Accuracy: 89.39%
Epoch [25/100], Training Loss: 0.3466, Training Accuracy: 97.16%, Test Accuracy: 89.90%
Epoch [26/100], Training Loss: 0.3453, Training Accuracy: 97.16%, Test Accuracy: 90.91%
Epoch [27/100], Training Loss: 0.3447, Training Accuracy: 97.29%, Test Accuracy: 89.65%
Epoch [28/100], Training Loss: 0.3439, Training Accuracy: 97.22%, Test Accuracy: 89.65%
Epoch [29/100], Training Loss: 0.3424, Training Accuracy: 97.47%, Test Accuracy: 90.40%
Epoch [30/100], Training Loss: 0.3403, Training Accuracy: 97.60%, Test Accuracy: 88.89%
Epoch [31/100], Training Loss: 0.3392, Training Accuracy: 97.85%, Test Accuracy: 88.64%
Epoch [32/100], Training Loss: 0.3385, Training Accuracy: 97.73%, Test Accuracy: 88.13%
Epoch [33/100], Training Loss: 0.3387, Training Accuracy: 97.92%, Test Accuracy: 88.64%
Epoch [34/100], Training Loss: 0.3375, Training Accuracy: 98.04%, Test Accuracy: 88.38%
Epoch [35/100], Training Loss: 0.3365, Training Accuracy: 98.04%, Test Accuracy: 88.89%
Epoch [36/100], Training Loss: 0.3366, Training Accuracy: 97.92%, Test Accuracy: 88.13%
Epoch [37/100], Training Loss: 0.3358, Training Accuracy: 98.04%, Test Accuracy: 89.14%
Epoch [38/100], Training Loss: 0.3360, Training Accuracy: 97.92%, Test Accuracy: 89.14%
Epoch [39/100], Training Loss: 0.3358, Training Accuracy: 97.98%, Test Accuracy: 90.91%
Epoch [40/100], Training Loss: 0.3345, Training Accuracy: 98.11%, Test Accuracy: 89.39%
Epoch [41/100], Training Loss: 0.3343, Training Accuracy: 98.11%, Test Accuracy: 89.39%
Epoch [42/100], Training Loss: 0.3338, Training Accuracy: 98.11%, Test Accuracy: 89.90%
Epoch [43/100], Training Loss: 0.3345, Training Accuracy: 97.98%, Test Accuracy: 90.66%
Epoch [44/100], Training Loss: 0.3342, Training Accuracy: 98.17%, Test Accuracy: 91.16%
Epoch [45/100], Training Loss: 0.3338, Training Accuracy: 98.17%, Test Accuracy: 89.14%
Epoch [46/100], Training Loss: 0.3336, Training Accuracy: 98.17%, Test Accuracy: 91.16%
Epoch [47/100], Training Loss: 0.3333, Training Accuracy: 98.17%, Test Accuracy: 88.13%
Epoch [48/100], Training Loss: 0.3335, Training Accuracy: 98.11%, Test Accuracy: 91.16%
Epoch [49/100], Training Loss: 0.3330, Training Accuracy: 98.17%, Test Accuracy: 90.15%
Epoch [50/100], Training Loss: 0.3326, Training Accuracy: 98.23%, Test Accuracy: 89.39%
Epoch [51/100], Training Loss: 0.3319, Training Accuracy: 98.30%, Test Accuracy: 90.66%
Epoch [52/100], Training Loss: 0.3322, Training Accuracy: 98.23%, Test Accuracy: 90.91%
Epoch [53/100], Training Loss: 0.3317, Training Accuracy: 98.30%, Test Accuracy: 89.90%
Epoch [54/100], Training Loss: 0.3320, Training Accuracy: 98.23%, Test Accuracy: 90.91%
Epoch [55/100], Training Loss: 0.3314, Training Accuracy: 98.30%, Test Accuracy: 90.91%
Epoch [56/100], Training Loss: 0.3310, Training Accuracy: 98.42%, Test Accuracy: 89.90%
Epoch [57/100], Training Loss: 0.3305, Training Accuracy: 98.42%, Test Accuracy: 90.15%
Epoch [58/100], Training Loss: 0.3309, Training Accuracy: 98.42%, Test Accuracy: 90.66%
Epoch [59/100], Training Loss: 0.3304, Training Accuracy: 98.42%, Test Accuracy: 88.64%
Epoch [60/100], Training Loss: 0.3300, Training Accuracy: 98.42%, Test Accuracy: 89.90%
Epoch [61/100], Training Loss: 0.3306, Training Accuracy: 98.36%, Test Accuracy: 89.90%
Epoch [62/100], Training Loss: 0.3305, Training Accuracy: 98.42%, Test Accuracy: 91.41%
Epoch [63/100], Training Loss: 0.3301, Training Accuracy: 98.42%, Test Accuracy: 89.39%
Epoch [64/100], Training Loss: 0.3298, Training Accuracy: 98.42%, Test Accuracy: 91.16%
Epoch [65/100], Training Loss: 0.3301, Training Accuracy: 98.42%, Test Accuracy: 90.91%
Epoch [66/100], Training Loss: 0.3305, Training Accuracy: 98.42%, Test Accuracy: 89.14%
Epoch [67/100], Training Loss: 0.3305, Training Accuracy: 98.36%, Test Accuracy: 90.15%
Epoch [68/100], Training Loss: 0.3296, Training Accuracy: 98.42%, Test Accuracy: 89.39%
Epoch [69/100], Training Loss: 0.3302, Training Accuracy: 98.42%, Test Accuracy: 91.16%
Epoch [70/100], Training Loss: 0.3295, Training Accuracy: 98.48%, Test Accuracy: 89.39%
Epoch [71/100], Training Loss: 0.3292, Training Accuracy: 98.48%, Test Accuracy: 88.89%
Epoch [72/100], Training Loss: 0.3304, Training Accuracy: 98.30%, Test Accuracy: 91.41%
Epoch [73/100], Training Loss: 0.3298, Training Accuracy: 98.48%, Test Accuracy: 90.40%
Epoch [74/100], Training Loss: 0.3287, Training Accuracy: 98.48%, Test Accuracy: 89.65%
Epoch [75/100], Training Loss: 0.3290, Training Accuracy: 98.48%, Test Accuracy: 90.15%
Epoch [76/100], Training Loss: 0.3295, Training Accuracy: 98.48%, Test Accuracy: 89.14%
Epoch [77/100], Training Loss: 0.3287, Training Accuracy: 98.48%, Test Accuracy: 90.66%
Epoch [78/100], Training Loss: 0.3291, Training Accuracy: 98.48%, Test Accuracy: 90.15%
Epoch [79/100], Training Loss: 0.3293, Training Accuracy: 98.48%, Test Accuracy: 89.90%
Epoch [80/100], Training Loss: 0.3288, Training Accuracy: 98.48%, Test Accuracy: 91.16%
Epoch [81/100], Training Loss: 0.3289, Training Accuracy: 98.48%, Test Accuracy: 89.39%
Epoch [82/100], Training Loss: 0.3293, Training Accuracy: 98.48%, Test Accuracy: 89.14%
Epoch [83/100], Training Loss: 0.3291, Training Accuracy: 98.42%, Test Accuracy: 90.91%
Epoch [84/100], Training Loss: 0.3284, Training Accuracy: 98.55%, Test Accuracy: 89.39%
Epoch [85/100], Training Loss: 0.3289, Training Accuracy: 98.48%, Test Accuracy: 89.65%
Epoch [86/100], Training Loss: 0.3282, Training Accuracy: 98.55%, Test Accuracy: 90.15%
Epoch [87/100], Training Loss: 0.3289, Training Accuracy: 98.55%, Test Accuracy: 89.65%
Epoch [88/100], Training Loss: 0.3287, Training Accuracy: 98.55%, Test Accuracy: 90.91%
Epoch [89/100], Training Loss: 0.3290, Training Accuracy: 98.48%, Test Accuracy: 89.90%
Epoch [90/100], Training Loss: 0.3289, Training Accuracy: 98.48%, Test Accuracy: 89.90%
Epoch [91/100], Training Loss: 0.3285, Training Accuracy: 98.55%, Test Accuracy: 90.66%
Epoch [92/100], Training Loss: 0.3282, Training Accuracy: 98.55%, Test Accuracy: 89.14%
Epoch [93/100], Training Loss: 0.3282, Training Accuracy: 98.48%, Test Accuracy: 91.16%
Epoch [94/100], Training Loss: 0.3288, Training Accuracy: 98.48%, Test Accuracy: 90.66%
Epoch [95/100], Training Loss: 0.3285, Training Accuracy: 98.55%, Test Accuracy: 89.65%
Epoch [96/100], Training Loss: 0.3277, Training Accuracy: 98.61%, Test Accuracy: 90.15%
Epoch [97/100], Training Loss: 0.3281, Training Accuracy: 98.55%, Test Accuracy: 90.40%
Epoch [98/100], Training Loss: 0.3288, Training Accuracy: 98.55%, Test Accuracy: 90.15%
Epoch [99/100], Training Loss: 0.3282, Training Accuracy: 98.55%, Test Accuracy: 90.91%
Epoch [100/100], Training Loss: 0.3283, Training Accuracy: 98.55%, Test Accuracy: 91.16%
Finished Training
Final Evaluation: Precision: 0.9117, Recall: 0.9116, F1 Score: 0.9112, Accuracy: 0.9116
Fold 5/5
Epoch [1/100], Training Loss: 0.6800, Training Accuracy: 55.43%, Test Accuracy: 59.34%
Epoch [2/100], Training Loss: 0.6468, Training Accuracy: 64.84%, Test Accuracy: 79.80%
Epoch [3/100], Training Loss: 0.5994, Training Accuracy: 76.52%, Test Accuracy: 81.31%
Epoch [4/100], Training Loss: 0.5511, Training Accuracy: 79.99%, Test Accuracy: 81.82%
Epoch [5/100], Training Loss: 0.5144, Training Accuracy: 82.51%, Test Accuracy: 84.60%
Epoch [6/100], Training Loss: 0.4834, Training Accuracy: 85.16%, Test Accuracy: 86.62%
Epoch [7/100], Training Loss: 0.4602, Training Accuracy: 87.25%, Test Accuracy: 86.87%
Epoch [8/100], Training Loss: 0.4413, Training Accuracy: 88.95%, Test Accuracy: 88.13%
Epoch [9/100], Training Loss: 0.4203, Training Accuracy: 90.85%, Test Accuracy: 87.37%
Epoch [10/100], Training Loss: 0.4105, Training Accuracy: 91.22%, Test Accuracy: 88.38%
Epoch [11/100], Training Loss: 0.4042, Training Accuracy: 91.79%, Test Accuracy: 87.37%
Epoch [12/100], Training Loss: 0.3929, Training Accuracy: 93.43%, Test Accuracy: 89.39%
Epoch [13/100], Training Loss: 0.3821, Training Accuracy: 94.07%, Test Accuracy: 88.89%
Epoch [14/100], Training Loss: 0.3770, Training Accuracy: 94.51%, Test Accuracy: 89.39%
Epoch [15/100], Training Loss: 0.3693, Training Accuracy: 95.14%, Test Accuracy: 89.65%
Epoch [16/100], Training Loss: 0.3653, Training Accuracy: 95.83%, Test Accuracy: 88.89%
Epoch [17/100], Training Loss: 0.3604, Training Accuracy: 96.21%, Test Accuracy: 89.65%
Epoch [18/100], Training Loss: 0.3610, Training Accuracy: 95.96%, Test Accuracy: 90.15%
Epoch [19/100], Training Loss: 0.3596, Training Accuracy: 96.02%, Test Accuracy: 89.90%
Epoch [20/100], Training Loss: 0.3532, Training Accuracy: 96.46%, Test Accuracy: 89.39%
Epoch [21/100], Training Loss: 0.3508, Training Accuracy: 96.97%, Test Accuracy: 89.65%
Epoch [22/100], Training Loss: 0.3502, Training Accuracy: 96.84%, Test Accuracy: 89.90%
Epoch [23/100], Training Loss: 0.3499, Training Accuracy: 96.84%, Test Accuracy: 89.90%
Epoch [24/100], Training Loss: 0.3496, Training Accuracy: 96.65%, Test Accuracy: 89.90%
Epoch [25/100], Training Loss: 0.3447, Training Accuracy: 97.35%, Test Accuracy: 90.91%
Epoch [26/100], Training Loss: 0.3447, Training Accuracy: 97.29%, Test Accuracy: 90.66%
Epoch [27/100], Training Loss: 0.3438, Training Accuracy: 97.22%, Test Accuracy: 90.40%
Epoch [28/100], Training Loss: 0.3430, Training Accuracy: 97.41%, Test Accuracy: 90.15%
Epoch [29/100], Training Loss: 0.3439, Training Accuracy: 97.22%, Test Accuracy: 90.40%
Epoch [30/100], Training Loss: 0.3436, Training Accuracy: 97.35%, Test Accuracy: 90.66%
Epoch [31/100], Training Loss: 0.3429, Training Accuracy: 97.29%, Test Accuracy: 90.15%
Epoch [32/100], Training Loss: 0.3410, Training Accuracy: 97.66%, Test Accuracy: 90.15%
Epoch [33/100], Training Loss: 0.3415, Training Accuracy: 97.54%, Test Accuracy: 90.40%
Epoch [34/100], Training Loss: 0.3399, Training Accuracy: 97.41%, Test Accuracy: 90.91%
Epoch [35/100], Training Loss: 0.3407, Training Accuracy: 97.41%, Test Accuracy: 90.40%
Epoch [36/100], Training Loss: 0.3389, Training Accuracy: 97.60%, Test Accuracy: 90.66%
Epoch [37/100], Training Loss: 0.3383, Training Accuracy: 97.66%, Test Accuracy: 90.40%
Epoch [38/100], Training Loss: 0.3389, Training Accuracy: 97.41%, Test Accuracy: 89.39%
Epoch [39/100], Training Loss: 0.3385, Training Accuracy: 97.66%, Test Accuracy: 90.15%
Epoch [40/100], Training Loss: 0.3375, Training Accuracy: 97.85%, Test Accuracy: 89.90%
Epoch [41/100], Training Loss: 0.3387, Training Accuracy: 97.60%, Test Accuracy: 90.15%
Epoch [42/100], Training Loss: 0.3364, Training Accuracy: 97.92%, Test Accuracy: 88.64%
Epoch [43/100], Training Loss: 0.3365, Training Accuracy: 97.98%, Test Accuracy: 90.66%
Epoch [44/100], Training Loss: 0.3368, Training Accuracy: 97.85%, Test Accuracy: 90.15%
Epoch [45/100], Training Loss: 0.3361, Training Accuracy: 97.85%, Test Accuracy: 90.40%
Epoch [46/100], Training Loss: 0.3354, Training Accuracy: 97.92%, Test Accuracy: 90.15%
Epoch [47/100], Training Loss: 0.3342, Training Accuracy: 98.04%, Test Accuracy: 90.40%
Epoch [48/100], Training Loss: 0.3348, Training Accuracy: 98.04%, Test Accuracy: 90.15%
Epoch [49/100], Training Loss: 0.3354, Training Accuracy: 97.98%, Test Accuracy: 89.65%
Epoch [50/100], Training Loss: 0.3350, Training Accuracy: 97.92%, Test Accuracy: 90.66%
Epoch [51/100], Training Loss: 0.3328, Training Accuracy: 98.17%, Test Accuracy: 90.40%
Epoch [52/100], Training Loss: 0.3329, Training Accuracy: 98.23%, Test Accuracy: 89.90%
Epoch [53/100], Training Loss: 0.3337, Training Accuracy: 98.04%, Test Accuracy: 90.91%
Epoch [54/100], Training Loss: 0.3338, Training Accuracy: 98.11%, Test Accuracy: 90.15%
Epoch [55/100], Training Loss: 0.3331, Training Accuracy: 98.17%, Test Accuracy: 89.90%
Epoch [56/100], Training Loss: 0.3344, Training Accuracy: 97.98%, Test Accuracy: 89.90%
Epoch [57/100], Training Loss: 0.3331, Training Accuracy: 98.11%, Test Accuracy: 91.16%
Epoch [58/100], Training Loss: 0.3329, Training Accuracy: 98.17%, Test Accuracy: 90.15%
Epoch [59/100], Training Loss: 0.3328, Training Accuracy: 98.17%, Test Accuracy: 90.15%
Epoch [60/100], Training Loss: 0.3332, Training Accuracy: 98.04%, Test Accuracy: 90.15%
Epoch [61/100], Training Loss: 0.3330, Training Accuracy: 98.11%, Test Accuracy: 90.91%
Epoch [62/100], Training Loss: 0.3329, Training Accuracy: 98.17%, Test Accuracy: 90.15%
Epoch [63/100], Training Loss: 0.3321, Training Accuracy: 98.23%, Test Accuracy: 90.66%
Epoch [64/100], Training Loss: 0.3322, Training Accuracy: 98.17%, Test Accuracy: 90.40%
Epoch [65/100], Training Loss: 0.3325, Training Accuracy: 98.17%, Test Accuracy: 90.15%
Epoch [66/100], Training Loss: 0.3326, Training Accuracy: 98.17%, Test Accuracy: 90.91%
Epoch [67/100], Training Loss: 0.3327, Training Accuracy: 98.04%, Test Accuracy: 90.91%
Epoch [68/100], Training Loss: 0.3325, Training Accuracy: 98.17%, Test Accuracy: 91.16%
Epoch [69/100], Training Loss: 0.3311, Training Accuracy: 98.30%, Test Accuracy: 90.40%
Epoch [70/100], Training Loss: 0.3319, Training Accuracy: 98.23%, Test Accuracy: 90.40%
Epoch [71/100], Training Loss: 0.3326, Training Accuracy: 98.11%, Test Accuracy: 89.90%
Epoch [72/100], Training Loss: 0.3315, Training Accuracy: 98.23%, Test Accuracy: 90.91%
Epoch [73/100], Training Loss: 0.3315, Training Accuracy: 98.36%, Test Accuracy: 90.91%
Epoch [74/100], Training Loss: 0.3319, Training Accuracy: 98.23%, Test Accuracy: 90.40%
Epoch [75/100], Training Loss: 0.3311, Training Accuracy: 98.36%, Test Accuracy: 90.66%
Epoch [76/100], Training Loss: 0.3311, Training Accuracy: 98.23%, Test Accuracy: 90.66%
Epoch [77/100], Training Loss: 0.3310, Training Accuracy: 98.36%, Test Accuracy: 90.40%
Epoch [78/100], Training Loss: 0.3307, Training Accuracy: 98.36%, Test Accuracy: 90.66%
Epoch [79/100], Training Loss: 0.3300, Training Accuracy: 98.42%, Test Accuracy: 90.40%
Epoch [80/100], Training Loss: 0.3301, Training Accuracy: 98.36%, Test Accuracy: 90.40%
Epoch [81/100], Training Loss: 0.3308, Training Accuracy: 98.30%, Test Accuracy: 90.91%
Epoch [82/100], Training Loss: 0.3297, Training Accuracy: 98.42%, Test Accuracy: 90.40%
Epoch [83/100], Training Loss: 0.3293, Training Accuracy: 98.42%, Test Accuracy: 89.39%
Epoch [84/100], Training Loss: 0.3293, Training Accuracy: 98.48%, Test Accuracy: 90.40%
Epoch [85/100], Training Loss: 0.3281, Training Accuracy: 98.61%, Test Accuracy: 90.91%
Epoch [86/100], Training Loss: 0.3296, Training Accuracy: 98.42%, Test Accuracy: 89.14%
Epoch [87/100], Training Loss: 0.3305, Training Accuracy: 98.36%, Test Accuracy: 90.15%
Epoch [88/100], Training Loss: 0.3292, Training Accuracy: 98.42%, Test Accuracy: 90.66%
Epoch [89/100], Training Loss: 0.3292, Training Accuracy: 98.42%, Test Accuracy: 90.40%
Epoch [90/100], Training Loss: 0.3302, Training Accuracy: 98.36%, Test Accuracy: 90.15%
Epoch [91/100], Training Loss: 0.3296, Training Accuracy: 98.48%, Test Accuracy: 90.66%
Epoch [92/100], Training Loss: 0.3289, Training Accuracy: 98.48%, Test Accuracy: 90.66%
Epoch [93/100], Training Loss: 0.3289, Training Accuracy: 98.48%, Test Accuracy: 90.66%
Epoch [94/100], Training Loss: 0.3291, Training Accuracy: 98.42%, Test Accuracy: 90.66%
Epoch [95/100], Training Loss: 0.3293, Training Accuracy: 98.48%, Test Accuracy: 90.66%
Epoch [96/100], Training Loss: 0.3289, Training Accuracy: 98.48%, Test Accuracy: 90.66%
Epoch [97/100], Training Loss: 0.3292, Training Accuracy: 98.48%, Test Accuracy: 90.66%
Epoch [98/100], Training Loss: 0.3291, Training Accuracy: 98.48%, Test Accuracy: 90.15%
Epoch [99/100], Training Loss: 0.3292, Training Accuracy: 98.48%, Test Accuracy: 90.66%
Epoch [100/100], Training Loss: 0.3292, Training Accuracy: 98.48%, Test Accuracy: 90.66%
Finished Training
Final Evaluation: Precision: 0.9073, Recall: 0.9066, F1 Score: 0.9068, Accuracy: 0.9066
Average precision: 0.9079083878939004
Standard deviation precision: 0.011527810684365425
Average recall: 0.9070707070707071%
Standard deviation recall: 0.01199428493640194%
Average f1: 0.9070496288805945%
Standard deviation f1: 0.011885115740545493%
Average accuracy: 0.9070707070707071%
Standard deviation accuracy: 0.01199428493640194%
+ env
+ grep SLURM
SLURM_JOB_USER=zhuosl
SLURM_TASKS_PER_NODE=1
SLURM_JOB_UID=1044122
SLURM_TASK_PID=45564
SLURM_LOCALID=0
SLURM_SUBMIT_DIR=/home/zhuosl/VPML/DL_model
SLURMD_NODENAME=gpu-4-56
SLURM_NODE_ALIASES=(null)
SLURM_CLUSTER_NAME=farm
SLURM_CPUS_ON_NODE=32
SLURM_JOB_CPUS_PER_NODE=32
SLURM_GTIDS=0
SLURM_JOB_PARTITION=gpu-a100-h
SLURM_JOB_NUM_NODES=1
SLURM_JOBID=7620922
SLURM_JOB_QOS=datalabgrp-gpu-a100-h-qos
SLURM_PROCID=0
SLURM_CPUS_PER_TASK=32
SLURM_TOPOLOGY_ADDR=gpu-4-56
SLURM_TOPOLOGY_ADDR_PATTERN=node
SLURM_SCRIPT_CONTEXT=prolog_task
SLURM_MEM_PER_NODE=64000
SLURM_WORKING_CLUSTER=farm:192.168.12.90:6817:9728:109
SLURM_ROOT=/share/apps/22.04/slurm/22.05.9.p2
SLURM_NODELIST=gpu-4-56
SLURM_JOB_ACCOUNT=datalabgrp
SLURM_PRIO_PROCESS=0
SLURM_NNODES=1
SLURM_SUBMIT_HOST=farm
SLURM_JOB_ID=7620922
SLURM_NODEID=0
SLURM_CONF=/share/apps/22.04/slurm/22.05.9.p2/etc/slurm.conf
SLURM_JOB_NAME=VP_ML
SLURM_JOB_GID=1044122
SLURM_JOB_NODELIST=gpu-4-56
+ scontrol show job 7620922
JobId=7620922 JobName=VP_ML
   UserId=zhuosl(1044122) GroupId=zhuosl(1044122) MCS_label=N/A
   Priority=8956 Nice=0 Account=datalabgrp QOS=datalabgrp-gpu-a100-h-qos
   JobState=RUNNING Reason=None Dependency=(null)
   Requeue=1 Restarts=0 BatchFlag=1 Reboot=0 ExitCode=0:0
   RunTime=01:21:57 TimeLimit=3-12:00:00 TimeMin=N/A
   SubmitTime=2023-09-27T21:08:23 EligibleTime=2023-09-27T21:08:23
   AccrueTime=2023-09-27T21:08:23
   StartTime=2023-09-27T22:29:43 EndTime=2023-10-01T10:29:43 Deadline=N/A
   SuspendTime=None SecsPreSuspend=0 LastSchedEval=2023-09-27T22:29:43 Scheduler=Backfill
   Partition=gpu-a100-h AllocNode:Sid=127.0.1.1:4130660
   ReqNodeList=(null) ExcNodeList=(null)
   NodeList=gpu-4-56
   BatchHost=gpu-4-56
   NumNodes=1 NumCPUs=32 NumTasks=1 CPUs/Task=32 ReqB:S:C:T=0:0:*:*
   TRES=cpu=32,mem=62.50G,node=1,billing=32
   Socks/Node=* NtasksPerN:B:S:C=0:0:*:* CoreSpec=*
   MinCPUsNode=32 MinMemoryNode=62.50G MinTmpDiskNode=0
   Features=(null) DelayBoot=00:00:00
   OverSubscribe=OK Contiguous=0 Licenses=(null) Network=(null)
   Command=/home/zhuosl/VPML/DL_model/CNN.sh
   WorkDir=/home/zhuosl/VPML/DL_model
   StdErr=/home/zhuosl/VPML/DL_model/filter_genome_CNN_CUDA_drop0.4_fuke.log
   StdIn=/dev/null
   StdOut=/home/zhuosl/VPML/DL_model/filter_genome_CNN_CUDA_drop0.4_fuke.log
   Power=
   MailUser=zsliu@ucdavis.edu MailType=INVALID_DEPEND,BEGIN,END,FAIL,REQUEUE,STAGE_OUT
   

+ sstat --format JobID,MaxRSS,AveCPU -j 7620922
JobID            MaxRSS     AveCPU 
------------ ---------- ---------- 

############### Job 7620922 summary ###############
Name                : VP_ML
User                : zhuosl
Account             : datalabgrp
Partition           : gpu-a100-h
Nodes               : gpu-4-56
Cores               : 32
GPUs                : 0
State               : RUNNING
ExitCode            : --
Submit              : 2023-09-27T21:08:23
Start               : 2023-09-27T22:29:43
End                 : --
Waited              :   01:21:20
Reserved walltime   : 3-12:00:00
Used walltime       :   01:21:58
Used CPU time       :   00:00:00
% User (Computation): --
% System (I/O)      : --
Mem reserved        : 62.50G
Max Mem used        : --
Max Disk Write      : --
Max Disk Read       : --
